{
  "version": 2,
  "name": "馬雅各醫師台灣宣教足跡 1865-1871",
  "center": [22.9200, 120.3100],
  "zoom": 10,
  "spots": [
    {
      "id": "s1",
      "latlng": [22.6126, 120.2654],
      "num": 1,
      "title": "打狗港旗後（登陸地）",
      "desc": "1865年5月28日，29歲的馬雅各醫師（James Laidlaw Maxwell）與助手自廈門搭乘「META」號輪船，在打狗港旗後（今高雄旗津）登岸。他是英國長老教會第一位駐台灣宣教師，也是台灣基督教宣教的開拓者。同行者包括杜嘉德牧師（Carstairs Douglas）及三名本地助手。馬雅各選擇先北上台南府城展開醫療傳道事工，開啟了台灣現代醫療與基督教宣教的新頁。",
      "photo": null,
      "iconId": "default",
      "cardOffset": { "x": 0, "y": -60 }
    },
    {
      "id": "s2",
      "latlng": [22.9917, 120.1972],
      "num": 2,
      "title": "看西街醫館（台灣第一間西式醫院）",
      "desc": "1865年6月16日，馬雅各在台南府城西門外看西街（今仁愛街43號）租屋設立醫館與佈道所，前堂為禮拜堂、後堂為醫館。這是台灣史上第一間西式醫院，也是英國長老教會在台設教的紀念日。然而僅23天後（7月9日），當地漢醫散布馬雅各「取人心眼製藥」的謠言，激起民眾暴動圍攻醫館，史稱「看西街事件」。知縣要求馬雅各三日內撤離，他被迫南遷至旗後。",
      "photo": null,
      "iconId": "default",
      "cardOffset": { "x": 0, "y": -60 }
    },
    {
      "id": "s3",
      "latlng": [22.6152, 120.2637],
      "num": 3,
      "title": "旗後醫館與旗後教會",
      "desc": "1865年7月被逐出台南後，馬雅各退到有英國領事保護的旗後（今高雄旗津），租三間房屋設立醫館與禮拜堂，繼續醫療傳道。1866年6月，他在旗後山腰（今高雄燈塔下方）購地興建正式禮拜堂與可容納8張病床的醫館，命名「打狗禮拜堂」——這是台灣基督長老教會第一間禮拜堂。旗後教會現址為高雄市旗津區廟前路13號，2013年重建為七層哥德式尖頂建築。",
      "photo": null,
      "iconId": "default",
      "cardOffset": { "x": 0, "y": -60 }
    },
    {
      "id": "s4",
      "latlng": [22.6407, 120.3435],
      "num": 4,
      "title": "埤頭教會與醫館（鳳山）",
      "desc": "1867年7月，馬雅各在埤頭（今高雄鳳山區北門外）購屋，成立教會兼設醫館，每日奔波於旗後與埤頭之間。埤頭是當時鳳山縣治所在地，人口稠密，馬雅各以醫療為媒介向漢人傳教。然而1868年再度發生「埤頭迫害事件」，教會遭焚毀，信徒被毆打。此事件引發英國軍艦介入，迫使清廷簽訂條約保障基督教傳教自由，成為台灣教會史上的重要轉折。",
      "photo": null,
      "iconId": "default",
      "cardOffset": { "x": 0, "y": -60 }
    },
    {
      "id": "s5",
      "latlng": [23.0256, 120.4632],
      "num": 5,
      "title": "木柵教會（內門・平埔族宣教）",
      "desc": "1865年底，馬雅各在英國商人必麒麟（William A. Pickering）引領下，首次進入台南府城東方山區，拜訪西拉雅族平埔族部落。木柵（今高雄內門區木柵里）的族人熱情接納福音，與府城漢人的敵視形成強烈對比。1868年信徒集資興建木柵教會，為台灣第三座基督教堂。馬雅各在此建立的「府城東方山崗第一教區」，包含木柵、崗仔林、柑仔林、拔馬四間教會，是台灣最早的平埔族基督教社群。",
      "photo": null,
      "iconId": "default",
      "cardOffset": { "x": 0, "y": -60 }
    },
    {
      "id": "s6",
      "latlng": [23.0580, 120.4070],
      "num": 6,
      "title": "拔馬教會（左鎮）",
      "desc": "拔馬（今台南左鎮區）是西拉雅族部落的重要聚落。馬雅各在1866至1870年間多次造訪此地行醫傳道，因醫效卓著，帶領大批平埔族人歸信基督。1870年（清同治九年）拔馬教會正式成立。1871年4月，馬雅各離台前夕，邀請蘇格蘭攝影家約翰・湯姆生（John Thomson）同行，沿著他的宣教路線拍下珍貴的台灣早期影像，從打狗經拔馬、木柵、甲仙到荖濃，成為台灣最早的攝影紀錄之一。",
      "photo": null,
      "iconId": "default",
      "cardOffset": { "x": 0, "y": -60 }
    },
    {
      "id": "s7",
      "latlng": [22.9865, 120.2082],
      "num": 7,
      "title": "二老口醫館（舊樓醫院前身）",
      "desc": "1868年11月，經英國交涉後台南重新開放傳教，馬雅各於12月26日帶助手吳文水、高長回到台南。他在城南二老口街府東巷尾（今衛民街與北門路口附近）租得占地1,400坪的許厝舊樓，設立規模更大的醫館。這座「二老口醫館」後來被稱為「舊樓醫院」，是新樓醫院的前身。馬雅各在此期間不僅行醫，更積極訓練本地傳道人，為日後台灣教會的自立奠定基礎。",
      "photo": null,
      "iconId": "default",
      "cardOffset": { "x": 0, "y": -60 }
    },
    {
      "id": "s8",
      "latlng": [22.9929, 120.2048],
      "num": 8,
      "title": "太平境教會（亭仔腳禮拜堂）",
      "desc": "1869年7月，馬雅各在台南亭仔腳街（今青年路111號附近）租得民房，開設亭仔腳禮拜堂，這就是今日「太平境馬雅各紀念教會」的前身，也是台灣最早的基督教會之一。現址位於台南市中西區公園路6號，1902年改建為西洋式禮拜堂，為台南地標之一。2002年教會增建副堂時特設「馬雅各歷史資料館」，保存珍貴文物。此教會見證了台灣基督教從遭受迫害到深入社會的歷程。",
      "photo": null,
      "iconId": "default",
      "cardOffset": { "x": 0, "y": -60 }
    },
    {
      "id": "s9",
      "latlng": [22.9905, 120.2258],
      "num": 9,
      "title": "新樓醫院（馬雅各醫學紀念館）",
      "desc": "1900年，英國長老教會在台南東門路興建新醫院，由舊樓遷入，命名「新樓醫院」（Sin-lâu Hospital），延續馬雅各1865年創設看西街醫館的醫療傳道精神。馬雅各之子小馬雅各（James L. Maxwell Jr.）亦於1901年來台接續父親志業，在新樓醫院服務。2015年院方設立「馬雅各醫學紀念館」，展示馬雅各父子兩代在台灣的醫療宣教文物。新樓醫院現址為台南市東區東門路一段57號，是台灣歷史最悠久的西式醫院延續體。",
      "photo": null,
      "iconId": "default",
      "cardOffset": { "x": 0, "y": -60 }
    }
  ],
  "routes": [
    {
      "id": "r1",
      "name": "打狗至台南宣教之路（1865-1868）",
      "pts": [
        [22.6126, 120.2654],
        [22.6152, 120.2637],
        [22.6407, 120.3435],
        [22.9917, 120.1972]
      ],
      "color": "blue",
      "elevations": null
    },
    {
      "id": "r2",
      "name": "府城東方山崗平埔族宣教路線",
      "pts": [
        [22.9917, 120.1972],
        [22.9865, 120.2082],
        [23.0580, 120.4070],
        [23.0256, 120.4632]
      ],
      "color": "orange",
      "elevations": null
    },
    {
      "id": "r3",
      "name": "重返台南（1868-1871）",
      "pts": [
        [22.6152, 120.2637],
        [22.9865, 120.2082],
        [22.9929, 120.2048],
        [22.9905, 120.2258]
      ],
      "color": "green",
      "elevations": null
    }
  ]
}