{
  "version": 2,
  "name": "合歡山主峰步道",
  "center": [24.144, 121.277],
  "zoom": 15,
  "spots": [
    { "id": "s1", "latlng": [24.1393, 121.2835], "num": 1, "title": "武嶺觀景台", "desc": "台灣公路最高點 3,275m，360度展望", "photo": null, "iconId": "camera", "cardOffset": { "x": 80, "y": -70 } },
    { "id": "s2", "latlng": [24.1460, 121.2745], "num": 2, "title": "廢棄軍事碉堡", "desc": "步道中段地標，可入內參觀", "photo": null, "iconId": "info", "cardOffset": { "x": -100, "y": -50 } },
    { "id": "s3", "latlng": [24.1488, 121.2723], "num": 3, "title": "合歡主峰三角點", "desc": "三等三角點 6388 號，海拔 3,417m，可眺望奇萊連峰", "photo": null, "iconId": "rock", "cardOffset": { "x": 70, "y": -80 } }
  ],
  "routes": [
    {
      "id": "r1",
      "name": "合歡山主峰步道",
      "pts": [
        [24.1395, 121.2810], [24.1405, 121.2800], [24.1418, 121.2788],
        [24.1432, 121.2775], [24.1445, 121.2763], [24.1458, 121.2748],
        [24.1468, 121.2738], [24.1478, 121.2730], [24.1488, 121.2723]
      ],
      "color": "orange",
      "elevations": [3275, 3290, 3310, 3330, 3350, 3370, 3385, 3400, 3417]
    }
  ]
}
