{
  "version": 2,
  "name": "九份老街→金瓜石步道",
  "center": [25.109, 121.850],
  "zoom": 15,
  "spots": [
    { "id": "s1", "latlng": [25.1099, 121.8438], "num": 1, "title": "九份老街入口", "desc": "基山街口，從這裡開始逛", "photo": null, "iconId": "pin", "cardOffset": { "x": -100, "y": -70 } },
    { "id": "s2", "latlng": [25.1097, 121.8448], "num": 2, "title": "豎崎路石階", "desc": "神隱少女場景靈感，約 400 階紅燈籠石階", "photo": null, "iconId": "camera", "cardOffset": { "x": 90, "y": -50 } },
    { "id": "s3", "latlng": [25.1050, 121.8510], "num": 3, "title": "黃金瀑布", "desc": "礦水形成的天然金色瀑布", "photo": null, "iconId": "water", "cardOffset": { "x": -110, "y": -45 } },
    { "id": "s4", "latlng": [25.1082, 121.8552], "num": 4, "title": "黃金神社遺址", "desc": "日治時期礦山神社，石柱殘跡", "photo": null, "iconId": "info", "cardOffset": { "x": 80, "y": -80 } },
    { "id": "s5", "latlng": [25.1085, 121.8564], "num": 5, "title": "黃金博物館", "desc": "220kg 大金磚體驗，金瓜石礦業歷史", "photo": null, "iconId": "sun", "cardOffset": { "x": -90, "y": -60 } }
  ],
  "routes": [
    {
      "id": "r1",
      "name": "九份→金瓜石",
      "pts": [
        [25.1097, 121.8440], [25.1085, 121.8458], [25.1075, 121.8472],
        [25.1068, 121.8490], [25.1060, 121.8505], [25.1050, 121.8510],
        [25.1080, 121.8520], [25.1088, 121.8535], [25.1085, 121.8548],
        [25.1082, 121.8556], [25.1085, 121.8564]
      ],
      "color": "purple",
      "elevations": [280, 260, 240, 220, 200, 180, 220, 280, 320, 350, 370]
    }
  ]
}
