{
  "version": 2,
  "name": "彭蒙惠宣教師台灣服事足跡 1951-2024",
  "center": [24.2000, 121.3000],
  "zoom": 8,
  "spots": [
    {
      "id": "s1",
      "latlng": [31.2304, 121.4737],
      "num": 1,
      "title": "上海（中國宣教起點）",
      "desc": "1948年，22歲的彭蒙惠（Doris Marie Brougham）放棄紐約伊斯特曼音樂學院全額獎學金，從西雅圖搭船六週抵達中國上海，以宣教師身分展開服事。她11歲時在教會夏令營聽到計志文牧師談中國而立下宣教志向，華盛頓大學主修遠東研究畢業後便義無反顧前往。1949年中國政局劇變，彭蒙惠輾轉經香港，於1951年來到台灣，開始長達73年的台灣服事生涯。",
      "photo": null,
      "iconId": "default",
      "cardOffset": { "x": 0, "y": -60 }
    },
    {
      "id": "s2",
      "latlng": [23.9770, 121.6015],
      "num": 2,
      "title": "花蓮（台灣第一站）",
      "desc": "1951年彭蒙惠抵台後，選擇偏遠的台灣東岸花蓮為她的服事據點，在花蓮美崙落腳。她在此成立主日學、兒童合唱團，並到布農族、泰雅族、阿美族等原住民部落服事，獲賜阿美族名字「利百佳」。她以音樂為橋樑深入山地部落，用小喇叭和歌聲傳遞福音。1952年她在花蓮舉辦台灣第一個青年福音夏令營，吸引眾多年輕人參與，為日後的廣播事工埋下種子。",
      "photo": null,
      "iconId": "default",
      "cardOffset": { "x": 0, "y": -60 }
    },
    {
      "id": "s3",
      "latlng": [23.8580, 121.5470],
      "num": 3,
      "title": "玉山神學院（音樂教育）",
      "desc": "彭蒙惠在花蓮期間，進入玉山神學院（前身為美崙聖經書院，1949年創立於花蓮下美崙）擔任音樂教師，訓練主日學老師，為原住民教會培育音樂人才。玉山神學院是台灣基督長老教會專為原住民設立的神學教育機構，後遷至壽豐鄉鯉魚潭現址。彭蒙惠在此奠定了她結合音樂與福音的教學方法，日後這套方法也運用在空中英語教室的英語教學上，以活潑、對話式的方式取代枯燥的課本朗讀。",
      "photo": null,
      "iconId": "default",
      "cardOffset": { "x": 0, "y": -60 }
    },
    {
      "id": "s4",
      "latlng": [23.9873, 121.6058],
      "num": 4,
      "title": "花蓮電台（廣播福音起點）",
      "desc": "彭蒙惠在花蓮服事期間，開始在花蓮地方電台開設宗教性廣播節目，這是她運用媒體傳播福音的第一步。她發現廣播可以突破地理限制，將訊息傳遞到交通不便的山地部落。這段經驗讓她體悟到媒體的巨大力量——一個人站在麥克風前，可以同時對成千上萬人說話。這個領悟成為她日後創辦空中英語教室的核心動力，也奠定了她「以媒體為教室」的終身事業方向。",
      "photo": null,
      "iconId": "default",
      "cardOffset": { "x": 0, "y": -60 }
    },
    {
      "id": "s5",
      "latlng": [25.0785, 121.5525],
      "num": 5,
      "title": "救世傳播協會（ORTV 總部）",
      "desc": "1960年，彭蒙惠與李恩祺夫婦、唐主謙牧師夫婦在台北共同創辦「中華救世廣播團」（今救世傳播協會 ORTV），總部設於台北中山區大直街62巷10號。這是一個以基督教廣播為核心的媒體宣教機構，日後發展出空中英語教室、天韻合唱團、好消息電視台等多個事工。彭蒙惠擔任會長超過六十年，將一個小小的廣播團發展成華人世界最具影響力的基督教媒體機構之一。",
      "photo": null,
      "iconId": "default",
      "cardOffset": { "x": 0, "y": -60 }
    },
    {
      "id": "s6",
      "latlng": [25.0790, 121.5530],
      "num": 6,
      "title": "空中英語教室（Studio Classroom）",
      "desc": "1962年8月1日，「空中英語教室」正式在廣播中開播。彭蒙惠捨棄傳統「This is a pen」式的教學法，改以分享美國雜誌文章、用輕鬆對話方式講解英文。節目大受歡迎，應聽眾要求開始發行兩頁講義，從最初一元的黑白油印到發展成《大家說英語》、《空中英語教室》、《彭蒙惠英語 Advanced》三本分級雜誌。數十年來教導數百萬台灣人學英文，彭蒙惠因此被譽為「台灣英語教育之母」。",
      "photo": null,
      "iconId": "default",
      "cardOffset": { "x": 0, "y": -60 }
    },
    {
      "id": "s7",
      "latlng": [25.0780, 121.5520],
      "num": 7,
      "title": "天韻合唱團（Heavenly Melody）",
      "desc": "1963年，彭蒙惠創立「天韻詩班」（後改名天韻合唱團），製作台灣第一個福音電視節目《天韻歌聲》。天韻合唱團是台灣第一支全職專業的基督教音樂團隊，半個世紀以來走過36個國家舉辦福音音樂會。彭蒙惠本身精通小喇叭，曾獲伊斯特曼音樂學院全額獎學金。天韻合唱團在她的帶領下，不僅創作華語詩歌，更成為向國際展現台灣基督教音樂的重要窗口，深深影響了華語教會音樂的發展。",
      "photo": null,
      "iconId": "default",
      "cardOffset": { "x": 0, "y": -60 }
    },
    {
      "id": "s8",
      "latlng": [25.0330, 121.5654],
      "num": 8,
      "title": "台北國際會議中心（紀念音樂會）",
      "desc": "2024年8月6日，彭蒙惠在台北淡水馬偕醫院安息主懷，享壽98歲，遺囑交代「把一切全捐出」。9月20日，救世傳播協會在台北國際會議中心大會堂舉辦紀念音樂會，副總統蕭美琴代表賴清德總統頒發「褒揚令」，前總統蔡英文與馬英九分別致詞與致意。2023年她已獲蔡英文總統親頒中華民國護照與身分證，正式歸化為台灣公民。彭蒙惠用73年的歲月證明：台灣就是她的家。",
      "photo": null,
      "iconId": "default",
      "cardOffset": { "x": 0, "y": -60 }
    }
  ],
  "routes": [
    {
      "id": "r1",
      "name": "上海經花蓮到台北（1948-1960）",
      "pts": [
        [31.2304, 121.4737],
        [23.9770, 121.6015],
        [23.8580, 121.5470],
        [23.9873, 121.6058]
      ],
      "color": "blue",
      "elevations": null
    },
    {
      "id": "r2",
      "name": "台北媒體宣教事工（1960-2024）",
      "pts": [
        [23.9770, 121.6015],
        [25.0785, 121.5525],
        [25.0790, 121.5530],
        [25.0780, 121.5520],
        [25.0330, 121.5654]
      ],
      "color": "orange",
      "elevations": null
    }
  ]
}