{
  "version": 2,
  "name": "陽明山七星山步道",
  "center": [25.175, 121.545],
  "zoom": 14,
  "spots": [
    { "id": "s1", "latlng": [25.1667, 121.5344], "num": 1, "title": "小油坑遊客服務站", "desc": "步道起點，可欣賞火山噴氣孔地貌，設有廁所與解說站", "photo": null, "iconId": "info", "cardOffset": { "x": 90, "y": -65 } },
    { "id": "s2", "latlng": [25.1744, 121.5431], "num": 2, "title": "七星山東峰", "desc": "海拔約 1,108m，視野開闊，可遠眺台北盆地與淡水河口", "photo": null, "iconId": "sun", "cardOffset": { "x": -110, "y": -50 } },
    { "id": "s3", "latlng": [25.1795, 121.5385], "num": 3, "title": "七星山主峰", "desc": "海拔 1,120m，北台灣最高火山，天氣晴朗時可見基隆嶼", "photo": null, "iconId": "rock", "cardOffset": { "x": 80, "y": -80 } },
    { "id": "s4", "latlng": [25.1928, 121.5614], "num": 4, "title": "擎天崗草原", "desc": "廣闊青翠的高山草原，牛群自由漫步，陽明山最具代表性的景致", "photo": null, "iconId": "leaf", "cardOffset": { "x": -100, "y": -55 } }
  ],
  "routes": [
    {
      "id": "r1",
      "name": "小油坑→擎天崗",
      "pts": [
        [25.1667, 121.5344], [25.1685, 121.5358], [25.1700, 121.5378],
        [25.1718, 121.5398], [25.1732, 121.5418], [25.1744, 121.5431],
        [25.1760, 121.5420], [25.1778, 121.5402], [25.1795, 121.5385],
        [25.1825, 121.5425], [25.1858, 121.5478], [25.1895, 121.5548],
        [25.1928, 121.5614]
      ],
      "color": "green",
      "elevations": [810, 870, 940, 1000, 1060, 1108, 1100, 1115, 1120, 1050, 920, 800, 770]
    }
  ]
}
